<?xml version="1.0" encoding="UTF-8"?>
<mapping xmlns:xsi="http://www.w3.org/2001/XMLSchema-instance" xsi:noNamespaceSchemaLocation="../../../src/main/resources/mappingXMLToStandoff.xsd">
    <mappingElement>
        <tag><name>text</name><class>noClass</class><namespace>noNamespace</namespace></tag>
        <standoffClass>
            <classIri>http://www.knora.org/ontology/standoff#StandoffRootTag</classIri>
            <attributes>
                <attribute><attributeName>documentType</attributeName><namespace>noNamespace</namespace><propertyIri>http://www.knora.org/ontology/standoff#standoffRootTagHasDocumentType</propertyIri></attribute>
            </attributes>
        </standoffClass>
    </mappingElement>

    <mappingElement>
        <tag>
            <name>p</name>
            <class>noClass</class>
            <namespace>noNamespace</namespace>
        </tag>
        <standoffClass>
            <classIri>http://www.knora.org/ontology/standoff#StandoffParagraphTag</classIri>
        </standoffClass>
    </mappingElement>

    <mappingElement>
        <tag>
            <name>em</name>
            <class>noClass</class>
            <namespace>noNamespace</namespace>
        </tag>
        <standoffClass>
            <classIri>http://www.knora.org/ontology/standoff#StandoffItalicTag</classIri>
        </standoffClass>
    </mappingElement>

    <mappingElement>
        <tag>
            <name>strong</name>
            <class>noClass</class>
            <namespace>noNamespace</namespace>
        </tag>
        <standoffClass>
            <classIri>http://www.knora.org/ontology/standoff#StandoffBoldTag</classIri>
        </standoffClass>
    </mappingElement>

    <mappingElement>
        <tag>
            <name>u</name>
            <class>noClass</class>
            <namespace>noNamespace</namespace></tag>
        <standoffClass>
            <classIri>http://www.knora.org/ontology/standoff#StandoffUnderlineTag</classIri>
        </standoffClass>
    </mappingElement>

    <mappingElement>
        <tag>
            <name>sub</name>
            <class>noClass</class>
            <namespace>noNamespace</namespace>
        </tag>
        <standoffClass>
            <classIri>http://www.knora.org/ontology/standoff#StandoffSubscriptTag</classIri>
        </standoffClass>
    </mappingElement>

    <mappingElement>
        <tag>
            <name>sup</name>
            <class>noClass</class>
            <namespace>noNamespace</namespace>
        </tag>
        <standoffClass>
            <classIri>http://www.knora.org/ontology/standoff#StandoffSuperscriptTag</classIri>
        </standoffClass>
    </mappingElement>

    <mappingElement>
        <tag>
            <name>strike</name>
            <class>noClass</class>
            <namespace>noNamespace</namespace>
        </tag>
        <standoffClass>
            <classIri>http://www.knora.org/ontology/standoff#StandoffStrikethroughTag</classIri>
        </standoffClass>
    </mappingElement>

    <!-- a tag without class -> external link -->
    <mappingElement>
        <tag>
            <name>a</name>
            <class>noClass</class>
            <namespace>noNamespace</namespace>
        </tag>
        <standoffClass>
            <classIri>http://www.knora.org/ontology/knora-base#StandoffUriTag</classIri>
            <datatype>
                <type>http://www.knora.org/ontology/knora-base#StandoffUriTag</type>
                <attributeName>href</attributeName>
            </datatype>
        </standoffClass>
    </mappingElement>

    <!-- a tag with class "salsah-link" -> internal link -->
    <mappingElement>
        <tag>
            <name>a</name>
            <class>salsah-link</class>
            <namespace>noNamespace</namespace>
        </tag>
        <standoffClass>
            <classIri>http://www.knora.org/ontology/knora-base#StandoffLinkTag</classIri>
            <datatype>
                <type>http://www.knora.org/ontology/knora-base#StandoffLinkTag</type>
                <attributeName>href</attributeName>
            </datatype>
        </standoffClass>
    </mappingElement>

    <!-- span tag with class "date" -> data type date -->
    <mappingElement>
        <tag>
            <name>span</name>
            <class>date</class>
            <namespace>noNamespace</namespace>
        </tag>
        <standoffClass>
            <classIri>http://www.knora.org/ontology/knora-base#StandoffDateTag</classIri>
            <datatype>
                <type>http://www.knora.org/ontology/knora-base#StandoffDateTag</type>
                <attributeName>data-date</attributeName>
            </datatype>
        </standoffClass>
    </mappingElement>

    <!-- span tag with class "event" -> data type date -->
    <mappingElement>
        <tag>
            <name>span</name>
            <class>event</class>
            <namespace>noNamespace</namespace>
        </tag>
        <standoffClass>
            <classIri>http://www.knora.org/ontology/anything#StandoffEventTag</classIri>
            <attributes>
                <attribute><attributeName>data-description</attributeName><namespace>noNamespace</namespace><propertyIri>http://www.knora.org/ontology/anything#standoffEventTagHasDescription</propertyIri></attribute>
            </attributes>
            <datatype>
                <type>http://www.knora.org/ontology/knora-base#StandoffDateTag</type>
                <attributeName>data-date</attributeName>
            </datatype>
        </standoffClass>
    </mappingElement>

    <!-- span tag with class "interval" -> data type interval -->
    <mappingElement>
        <tag>
            <name>span</name>
            <class>interval</class>
            <namespace>noNamespace</namespace>
        </tag>
        <standoffClass>
            <classIri>http://www.knora.org/ontology/knora-base#StandoffIntervalTag</classIri>
            <datatype>
                <type>http://www.knora.org/ontology/knora-base#StandoffIntervalTag</type>
                <attributeName>data-interval</attributeName>
            </datatype>
        </standoffClass>
    </mappingElement>

    <!-- span tag with class "color" -> data type color -->
    <mappingElement>
        <tag>
            <name>span</name>
            <class>color</class>
            <namespace>noNamespace</namespace>
        </tag>
        <standoffClass>
            <classIri>http://www.knora.org/ontology/knora-base#StandoffColorTag</classIri>
            <datatype>
                <type>http://www.knora.org/ontology/knora-base#StandoffColorTag</type>
                <attributeName>data-color</attributeName>
            </datatype>
        </standoffClass>
    </mappingElement>

    <!-- span tag with class "integer" -> data type integer -->
    <mappingElement>
        <tag>
            <name>span</name>
            <class>integer</class>
            <namespace>noNamespace</namespace>
        </tag>
        <standoffClass>
            <classIri>http://www.knora.org/ontology/knora-base#StandoffIntegerTag</classIri>
            <datatype>
                <type>http://www.knora.org/ontology/knora-base#StandoffIntegerTag</type>
                <attributeName>data-integer</attributeName>
            </datatype>
        </standoffClass>
    </mappingElement>

    <!-- span tag with class "decimal" -> data type decimal -->
    <mappingElement>
        <tag>
            <name>span</name>
            <class>decimal</class>
            <namespace>noNamespace</namespace>
        </tag>
        <standoffClass>
            <classIri>http://www.knora.org/ontology/knora-base#StandoffDecimalTag</classIri>
            <datatype>
                <type>http://www.knora.org/ontology/knora-base#StandoffDecimalTag</type>
                <attributeName>data-decimal</attributeName>
            </datatype>
        </standoffClass>
    </mappingElement>

    <!-- span tag with class "boolean" -> data type boolean -->
    <mappingElement>
        <tag>
            <name>span</name>
            <class>boolean</class>
            <namespace>noNamespace</namespace>
        </tag>
        <standoffClass>
            <classIri>http://www.knora.org/ontology/knora-base#StandoffBooleanTag</classIri>
            <datatype>
                <type>http://www.knora.org/ontology/knora-base#StandoffBooleanTag</type>
                <attributeName>data-boolean</attributeName>
            </datatype>
        </standoffClass>
    </mappingElement>

</mapping>
