<?xml version="1.0" encoding="UTF-8"?>
<mapping xmlns:xsi="http://www.w3.org/2001/XMLSchema-instance"
         xsi:noNamespaceSchemaLocation="../../../modules/webapi/src/main/resources/mappingXMLToStandoff.xsd">
    <defaultXSLTransformation>toBeDefined</defaultXSLTransformation>
    <mappingElement>
        <tag>
            <name>text</name>
            <class>noClass</class>
            <namespace>noNamespace</namespace>
            <separatesWords>false</separatesWords>
        </tag>
        <standoffClass>
            <classIri>http://www.knora.org/ontology/standoff#StandoffRootTag</classIri>
            <attributes>
                <attribute>
                    <attributeName>documentType</attributeName>
                    <namespace>noNamespace</namespace>
                    <propertyIri>http://www.knora.org/ontology/standoff#standoffRootTagHasDocumentType</propertyIri>
                </attribute>
            </attributes>
        </standoffClass>
    </mappingElement>
    
    <mappingElement>
        <tag>
            <name>p</name>
            <class>noClass</class>
            <namespace>noNamespace</namespace>
            <separatesWords>true</separatesWords>
        </tag>
        <standoffClass>
            <classIri>http://www.knora.org/ontology/standoff#StandoffParagraphTag</classIri>
        </standoffClass>
    </mappingElement>

    <mappingElement>
        <tag>
            <name>i</name>
            <class>noClass</class>
            <namespace>noNamespace</namespace>
            <separatesWords>false</separatesWords>
        </tag>
        <standoffClass>
            <classIri>http://www.knora.org/ontology/standoff#StandoffItalicTag</classIri>
        </standoffClass>
    </mappingElement>

    <mappingElement>
        <tag>
            <name>b</name>
            <class>noClass</class>
            <namespace>noNamespace</namespace>
            <separatesWords>false</separatesWords>
        </tag>
        <standoffClass>
            <classIri>http://www.knora.org/ontology/standoff#StandoffBoldTag</classIri>
        </standoffClass>
    </mappingElement>

    <mappingElement>
        <tag>
            <name>facsimile</name>
            <class>noClass</class>
            <namespace>noNamespace</namespace>
            <separatesWords>false</separatesWords>
        </tag>
        <standoffClass>
            <classIri>http://www.knora.org/ontology/0801/beol#StandoffFacsimileTag</classIri>
            <datatype>
                <type>http://www.knora.org/ontology/knora-base#StandoffLinkTag</type>
                <attributeName>src</attributeName>
            </datatype>
        </standoffClass>
    </mappingElement>

    <mappingElement>
        <tag>
            <name>math</name>
            <class>noClass</class>
            <namespace>noNamespace</namespace>
            <separatesWords>false</separatesWords>
        </tag>
        <standoffClass>
            <classIri>http://www.knora.org/ontology/0801/beol#StandoffMathTag</classIri>
        </standoffClass>
    </mappingElement>

    <mappingElement>
        <tag>
            <name>ref</name>
            <class>noClass</class>
            <namespace>noNamespace</namespace>
            <separatesWords>false</separatesWords>
        </tag>
        <standoffClass>
            <classIri>http://www.knora.org/ontology/knora-base#StandoffInternalReferenceTag</classIri>
            <datatype>
                <type>http://www.knora.org/ontology/knora-base#StandoffInternalReferenceTag</type>
                <attributeName>href</attributeName>
            </datatype>
        </standoffClass>
    </mappingElement>

    <mappingElement>
        <tag>
            <name>sub</name>
            <class>noClass</class>
            <namespace>noNamespace</namespace>
            <separatesWords>false</separatesWords>
        </tag>
        <standoffClass>
            <classIri>http://www.knora.org/ontology/standoff#StandoffSubscriptTag</classIri>
        </standoffClass>
    </mappingElement>

    <mappingElement>
        <tag>
            <name>sup</name>
            <class>noClass</class>
            <namespace>noNamespace</namespace>
            <separatesWords>false</separatesWords>
        </tag>
        <standoffClass>
            <classIri>http://www.knora.org/ontology/standoff#StandoffSuperscriptTag</classIri>
        </standoffClass>
    </mappingElement>

    <mappingElement>
        <tag>
            <name>a</name>
            <class>noClass</class>
            <namespace>noNamespace</namespace>
            <separatesWords>false</separatesWords>
        </tag>
        <standoffClass>
            <classIri>http://www.knora.org/ontology/knora-base#StandoffUriTag</classIri>
            <datatype>
                <type>http://www.knora.org/ontology/knora-base#StandoffUriTag</type>
                <attributeName>href</attributeName>
            </datatype>
        </standoffClass>
    </mappingElement>

</mapping>